Related Attacks,Count
on version 14.1.x before 14.1.4.4 and all versions of 13.1.x,1
exposure of system data to an unauthorized control sphere  attack,1
a null pointer  attack,1
cleartext storage of sensitive information in memory  attack,2
eaton intelligent power manager (ipm) prior to 1.69 is vulnerable to unauthenticated eval injection  attack,1
eaton intelligent power manager (ipm) prior to 1.69 is vulnerable to authenticated arbitrary file delete  attack,1
eaton intelligent power manager (ipm) prior to 1.69 is vulnerable to unauthenticated arbitrary file delete  attack,1
eaton intelligent power manager (ipm) prior to 1.69 is vulnerable to authenticated arbitrary file upload  attack,1
this affects all versions of package iniparserjs. this  attack,1
this affects the package pimcore/pimcore before 6.8.8. a local file inclusion  attack,1
this affects the package clearance before 2.5.0. the  attack,1
html code injection  attack,1
clear text storage of sensitive information in memory  attack,1
a stored cross site scripting  attack,2
unvalidated client-side url redirect  attack,1
information leak  attack,1
firefox for android suffered from a time-of-check-time-of-use  attack,2
an improper following of a certificate's chain of trust  attack,1
a type confusion  attack,1
in wolfssl through 4.6.0,1
a side-channel  attack,3
in apache teaclave rust sgx sdk 1.1.3,1
in trusted firmware mbed tls 2.24.0,1
the jetpack scan team identified a local file disclosure  attack,1
the jetpack scan team identified a cross-site request forgery  attack,1
the yop poll wordpress plugin before 6.3.1 is affected by a stored cross-site scripting  attack,2
a server-side request forgery (ssrf) information disclosure  attack,2
an improper access control information disclosure  attack,2
nagios xi version xi-5.7.5 is affected by os command injection. the  attack,3
a creation of temporary file with insecure permissions  attack,1
a insecure temporary file  attack,2
a incorrect permission assignment for critical resource  attack,1
skyworth digital technology rn510 v.3.1.0.4 is affected by an incorrect access control  attack,1
hijacking  attack,2
improper caller check  attack,1
an improper input validation  attack,4
a possible out of bounds write  attack,1
a possible buffer overflow  attack,1
improper component protection  attack,2
improper log management  attack,4
improper check  attack,1
improper validation check  attack,1
an improper file management  attack,1
an improper scheme check  attack,1
improper scheme check  attack,1
a possible guessing and confirming a byte memory  attack,1
a possible heap-based buffer overflow  attack,2
a possible stack-based buffer overflow  attack,1
exposure of information  attack,1
improper check or handling of exception conditions  attack,1
improper export of android application components  attack,1
cosmos network ethermint <= v0.4.0 is affected by a transaction replay  attack,1
cosmos network ethermint <= v0.4.0 is affected by a cross-chain transaction replay  attack,1
a weak password requirement  attack,1
“shuup” application in versions 0.4.2 to 2.10.8 is affected by the “formula injection”  attack,1
a missing release of memory after effective lifetime  attack,1
a use of a one-way hash with a predictable salt  attack,1
apache ofbiz has unsafe deserialization prior to 17.12.06. an unauthenticated attacker can use this  attack,1
the gitlog function in src/index.ts in gitlog before 4.0.4 has a command injection  attack,1
"the ""gitdiff"" function in wayfair git-parse <=1.0.4 has a command injection  attack",1
insertion of sensitive information into sent data  attack,1
an arbitrary file download and execution  attack,1
an path traversal  attack,1
clustered data ontap versions prior to 9.3p21,1
9.5p16,1
9.6p12,1
9.7p8 and 9.8 are susceptible to a  attack,1
system manager 9.x versions 9.7 and higher prior to 9.7p16,1
9.8p7 and 9.9.1p2 are susceptible to a  attack,1
netapp virtual desktop service (vds) when used with an html5 gateway is susceptible to a  attack,1
opensis community edition version <= 7.6 is affected by a local file inclusion  attack,1
riot-os 2020.01 contains a buffer overflow  attack,1
an attacker could exploit this  attack,1
mesa labs amegaview versions 3.0 and prior has a command injection  attack,1
there is a null pointer dereference  attack,3
incorrect handling of url fragment  attack,1
cross site scripting  attack,2
successful exploitation of this  attack,4
riot-os 2021.01 contains a buffer overflow  attack,2
hcl commerce is affected by an insufficient session expiration  attack,1
sametime android potential path traversal  attack,1
there is a security  attack,1
a csv injection  attack,1
a divide-by-zero  attack,1
division-by-zero  attack,1
ikuaios 3.4.8 build 202012291059 has an arbitrary file download  attack,1
a man-in-the-middle  attack,1
eclipse jersey 2.28 to 2.33 and eclipse jersey 3.0.0 to 3.0.1 contains a local information disclosure  attack,1
heap-based buffer overflow  attack,1
seceon aisiem before 6.3.2 (build 585) is prone to an unauthenticated account takeover  attack,1
this advisory documents the impact of an internally found  attack,2
adobe media encoder version 15.1 (and earlier) is affected by an out-of-bounds read  attack,1
adobe after effects version 18.1 (and earlier) is affected by an uncontrolled search path element  attack,1
adobe animate version 21.0.5 (and earlier) is affected by an out-of-bounds read  attack,4
adobe illustrator version 25.2.3 (and earlier) is affected by a use after free  attack,1
adobe after effects version 18.2 (and earlier) is affected by an out-of-bounds read  attack,2
adobe after effects version 18.2 (and earlier) is affected by an our-of-bounds read  attack,1
adobe animate version 21.0.6 (and earlier) is affected by an out-of-bounds read  attack,4
an insecure file permissions  attack,1
trend micro password manager version 5 (consumer) is vulnerable to a dll hijacking  attack,1
vscode-restructuredtext before 146.0.0 contains an incorrect access control  attack,1
a relative path traversal  attack,1
a command injection vulnerabilities have been reported to affect qts and quts hero. if exploited,2
this  attack,3
if exploited,1
null pointer dereference  attack,3
** disputed ** python 3.x through 3.10 has an open redirection  attack,1
serenityos fixed as of c9f25bca048443e317f1994ba9b106f2386688c3 contains a buffer overflow  attack,1
bab technologie gmbh eibport v3 prior version 3.9.1 contains basic ssrf  attack,1
arbitrary file upload  attack,1
rconfig 3.9.6 is affected by a local file disclosure  attack,1
a regular expression denial of service (redos)  attack,13
a local buffer overflow  attack,2
a potential local buffer overflow  attack,1
btcpay server before 1.0.6.0,1
when the payment button is used,1
has a privacy  attack,1
file upload  attack,1
in gradle from version 5.1 and before version 7.0 there is a  attack,1
sabnzbd is an open source binary newsreader. a  attack,1
ticketer is a command based ticket system cog (plugin) for the red discord bot. a  attack,1
warnsystem is a cog (plugin) for the red discord bot. a  attack,1
a transient execution  attack,1
serenityos 2021-03-27 contains a buffer overflow  attack,1
a stored html injection  attack,1
feehi cms 2.1.1 is affected by a server-side request forgery (ssrf)  attack,1
textpattern v4.8.4 contains an arbitrary file upload  attack,1
an os command argument injection  attack,1
runc before 1.0.0-rc95 allows a container filesystem breakout via directory traversal. to exploit the  attack,1
an improper verification of cryptographic signature  attack,1
an issue was discovered in hcc embedded interniche 4.0.1. this  attack,1
the alertmanager in cncf cortex before 1.8.1 has a local file disclosure  attack,1
a crlf injection  attack,1
on ptx1000 system,1
ptx10002-60c system,1
after upgrading to an affected release,1
a race condition  attack,2
authenticated (admin+) arbitrary file download  attack,1
emlog v5.3.1 and emlog v6.0.0 have a remote code execution  attack,1
session fixation  attack,1
an inadequate encryption  attack,1
** unsupported when assigned ** d-link dcs-5220 devices have a buffer overflow. note: this  attack,1
improper neutralization of input during web page generation ('cross-site scripting')  attack,1
stored cross-site scripting  attack,1
an http request smuggling  attack,1
a reliance on untrusted inputs in a security decision  attack,2
unprotected transport of credentials  attack,1
this issue affects: secomea gatemanager version 9.6.621421014 and all prior versions. permission issues  attack,1
inadequate encryption strength  attack,1
sick visionary-s cx up version 5.21.2.29154r are vulnerable to an inadequate encryption strength  attack,1
directory listing  attack,1
use of hard-coded cryptographic key  attack,1
the qsan sanos setting page does not filter special parameters. remote attackers can use this  attack,1
qsan sanos factory reset function does not filter special parameters. remote attackers can use this  attack,1
realtek had contains a driver crashed  attack,1
kuaifancms v5.x contains an arbitrary file read  attack,1
an unsafe search path  attack,1
a use of one-way hash with a predictable salt  attack,1
in archive_tar before 1.4.14,1
symlinks can refer to targets outside of the extracted archive,1
nextcloud server is a nextcloud package that handles data storage. a  attack,1
symfony is a php framework for web and console applications and a set of reusable php components. a  attack,1
elabftw is an open source electronic lab notebook for research labs. this  attack,1
xwiki platform is a generic wiki platform offering runtime services for applications built on top of it. a  attack,1
icinga web 2 is an open source monitoring web interface,1
framework,1
and command-line interface. a  attack,1
ether logs is a package that allows one to check one's logs in the craft 3 utilities section. a  attack,1
ckeditor is an open source wysiwyg html editor with rich content support. a  attack,1
ckeditor is an open source wysiwyg html editor with rich content support. a potential  attack,2
emlog v5.3.1 has full path disclosure  attack,1
webaccess/nms (versions prior to v3.0.3_build6299) has an improper authentication  attack,1
some dahua products have access control  attack,1
improper limitation of a pathname to a restricted directory ('path traversal')  attack,2
the trendnet ti-pg1284i switch(hw v2.0r) prior to version 2.0.2.s0 suffers from an integer underflow  attack,2
the trendnet ti-pg1284i switch(hw v2.0r) prior to version 2.0.2.s0 suffers from a null pointer dereference  attack,1
there is an arbitrary password modification  attack,1
an use-after-free  attack,3
mashzone nextgen through 10.7 ga has an ssrf  attack,1
task hijacking is a  attack,1
insecure direct object reference (idor)  attack,1
china mobile an lianbao wf-1 router v1.0.1 is affected by an os command injection  attack,1
"an issue was discovered in edgegallery/developer before v1.0. there is a ""deserialization of yaml file""  attack",1
thecus 4800eco was discovered to contain a command injection  attack,1
miniaudio 0.10.35 has a double free  attack,1
ming 0.4.8 has an out-of-bounds read  attack,1
trusty contains a  attack,4
trusty tlk contains a  attack,3
the arm trustzone technology on which trusty is based on contains a  attack,1
nvidia tegra kernel driver contains a  attack,1
a flaw was found in qt. an out-of-bounds read  attack,1
jamf pro before 10.30.1 allows for an unvalidated url redirect  attack,1
a shell metacharacter injection  attack,1
a flaw was found in the red hat ceph storage radosgw (ceph object gateway) in versions before 14.2.21. the  attack,1
this broken access control  attack,1
solarwinds received a report of a  attack,1
** disputed ** in tcl 8.6.11,1
an incorrect access control  attack,4
a server-side request forgery (ssrf)  attack,2
backup file without encryption  attack,1
password autocomplete  attack,1
execution with unnecessary privileges  attack,1
adobe bridge version 11.0.2 (and earlier) is affected by an uninitialized variable  attack,1
adobe bridge version 11.0.2 (and earlier) is affected by an out-of-bounds read  attack,1
adobe after effects version 18.2.1 (and earlier) is affected by an improper input validation  attack,1
adobe character animator version 4.2 (and earlier) is affected by an out-of-bounds read  attack,1
adobe audition version 14.2 (and earlier) is affected by an out-of-bounds read  attack,1
adobe prelude version 10.0 (and earlier) are affected by an uninitialized variable  attack,1
adobe illustrator version 25.2.3 (and earlier) is affected by an use-after-free  attack,1
adobe media encoder version 15.2 (and earlier) is affected by an uninitialized pointer  attack,1
adobe media encoder version 15.2 (and earlier) is affected by an out-of-bounds read  attack,1
adobe after effects version 18.2.1 (and earlier) is affected by an out-of-bounds read  attack,2
phpmailer 6.4.1 and earlier contain a  attack,1
adobe connect version 11.2.2 (and earlier) is affected by a secure design principles violation  attack,1
adobe connect version 11.2.2 (and earlier) is affected by a reflected cross-site scripting  attack,2
adobe media encoder version 15.1 (and earlier) is affected by an improper memory access  attack,1
adobe bridge version 11.1 (and earlier) is affected by a heap-based buffer overflow  attack,1
adobe bridge version 11.1 (and earlier) is affected by an out-of-bounds read  attack,1
an exposure of sensitive information to an unauthorized actor cwe-200  attack,1
running a  attack,1
dell vnx2 for file version 8.1.21.266 and earlier,1
contain a path traversal  attack,1
dell vnx2 oe for file versions 8.1.21.266 and earlier,1
contain a sensitive information disclosure  attack,2
supportassist client version 3.8 and 3.9 contains an untrusted search path  attack,1
dell enterprise sonic os,1
versions 3.3.0 and earlier,1
contains a sensitive information disclosure  attack,1
a flaw was found in keycloak. this  attack,1
wyse management suite 3.3.1 and below versions contain a deserialization  attack,1
dell emc scg 5.00.00.10 and earlier,1
in yellowfin before 9.6.1 there is a stored cross-site scripting  attack,1
thinkphp v6.0.8 was discovered to contain a deserialization  attack,2
synerion timenet version 9.21 contains a directory traversal  attack,1
a exposure of sensitive information to an unauthorized actor  attack,2
a cleartext storage of sensitive information  attack,1
a improper privilege management  attack,2
akaunting version 2.1.12 and earlier suffers from a password reset spoofing  attack,1
authenticated insecure direct object references (idor)  attack,1
unauthenticated privilege escalation  attack,1
unauthenticated arbitrary options update  attack,1
authenticated database reset  attack,1
there is a parameter verification issue in huawei smartphone.successful exploitation of this  attack,1
there is a kernel crash  attack,1
there is a public key verification  attack,1
there is a memory leaks  attack,1
there is a register tampering  attack,1
there is a memory out-of-bounds access  attack,1
there is a improper input validation  attack,16
there is a improper preservation of permissions  attack,2
there is a out-of-bounds read  attack,7
there is a configuration  attack,1
there is a exposure of sensitive information to an unauthorized actor  attack,2
there is a stack-based buffer overflow  attack,5
there is a data processing errors  attack,2
there is a heap-based buffer overflow  attack,7
there is a improper access control  attack,2
there is an identity verification  attack,1
there is an improper permission  attack,1
there is a bypass  attack,1
there is an injection attack  attack,1
there is an unstandardized field names in huawei smartphone.successful exploitation of this  attack,1
there is an invalid address access  attack,1
there is a permission control  attack,4
there is an uaf  attack,1
there is a memory leak  attack,2
there is a missing sensitive data encryption  attack,1
there is an exception log  attack,1
there is an improper permission control  attack,1
there is a improper validation of array index  attack,2
there is a permissions,2
privileges,3
and access controls  attack,3
there is a cryptographic issues  attack,1
there is a improper limitation of a pathname to a restricted directory  attack,1
there is a integer overflow or wraparound  attack,1
there is a incorrect calculation of buffer size  attack,1
there is a incomplete cleanup  attack,3
hilinksvc service exists a data processing errors  attack,1
there is a server-side request forgery  attack,1
there is an improper file upload control  attack,1
there is an improper memory access permission configuration on acpu.successful exploitation of this  attack,1
there is a timing design defects in smartphone.successful exploitation of this  attack,1
there is a memory leakage  attack,1
hisuite module has a external control of system or configuration setting  attack,1
there is a privilege escalation  attack,1
there is an unauthorized rewriting  attack,3
pcmanager has a weaknesses introduced during design  attack,1
the hwnearbymain module has a improper handling of exceptional conditions  attack,1
there is a configuration defects in smartphone.successful exploitation of this  attack,1
there is a use-after-free (uaf)  attack,1
arbitrary file has a exposure of sensitive information to an unauthorized actor  attack,2
hwpcassistant has a path traversal  attack,2
packagemanagerservice has a permissions,1
location-related apis exists a race condition  attack,1
** unsupported when assigned ** a command-injection  attack,1
nagios enterprises nagiosxi <= 5.8.4 contains a server-side request forgery (ssrf)  attack,1
a stack overflow  attack,3
gcc c++filt v2.26 was discovered to contain a use-after-free  attack,1
ctparental before 4.45.07 is affected by a code execution  attack,1
nch flexiserver v6.00 suffers from a syslog?file=/.. path traversal  attack,1
a flaw was found in the libtpms code that may cause access beyond the boundary of internal buffers. the  attack,1
a flaw was found in the linux kernel. a use-after-free  attack,1
tmerc-cogs are a collection of open source plugins for the red discord bot. a  attack,2
@github/paste-markdown is an npm package for pasting markdown objects. a self cross-site scripting  attack,1
shopware is an open source ecommerce platform. versions prior to 6.4.3.1 contain a  attack,2
shopware is an open source ecommerce platform. versions prior to 6.4.3.1 contain a command injection  attack,1
shopware is an open source ecommerce platform. versions prior to 6.4.3.1 contain a cross-site scripting  attack,1
versions prior to 6.4.3.1 contain an authenticated server-side request forgery  attack,1
a local path traversal  attack,1
arbitrary file deletion  attack,2
nucleus cms v3.71 is affected by a file upload  attack,1
myadmin v1.0 is affected by an incorrect access control  attack,1
eset was made aware of a  attack,1
zoho manageengine admanager plus version 7110 and prior has a post-auth os command injection  attack,1
an information disclosure via get request server-side request forgery  attack,1
integer overflow  attack,5
ippp82.flt in corel presentations 2020 20.0.0.200 is affected by an out-of-bounds read  attack,2
ippp72.flt in corel presentations 2020 20.0.0.200 is affected by an out-of-bounds read  attack,1
uax200.dll in corel presentations 2020 20.0.0.200 is affected by an out-of-bounds read  attack,1
cdrcore.dll in corel drawstandard 2020 22.0.0.474 is affected by an out-of-bounds read  attack,1
word97import200.dll in corel wordperfect 2020 20.0.0.200 is affected by an out-of-bounds read  attack,1
corel drawstandard 2020 22.0.0.474 is affected by an out-of-bounds read  attack,1
a potential information leakage  attack,1
sap commoncryptolib version 8.5.38 or lower is vulnerable to null pointer dereference  attack,1
a host header attack  attack,1
a use of hard-coded password  attack,1
the rndis usb device class includes a buffer overflow  attack,1
a command-injection  attack,1
in nascent remkon device manager 4.0.0.0,1
softvibe saraban for infoma 1.1 has incorrect access control  attack,1
fuel cms 1.5.0 has a brute force  attack,1
allwinner r818 soc android q sdk v1.0 is affected by an incorrect access control  attack,1
go-ethereum is the official go implementation of the ethereum protocol. in affected versions a consensus- attack,1
spinnaker is an open source,1
multi-cloud continuous delivery platform. a path traversal  attack,1
openolat is a web-based learning management system (lms). a path traversal  attack,1
tremor is an event processing system for unstructured data. a  attack,1
the server in jamf pro before 10.32.0 has an ssrf  attack,1
dwsurvey v3.2.0 was discovered to contain an arbitrary file write  attack,1
an incorrect default permissions  attack,1
adobe digital editions 4.5.11.187646 (and earlier) are affected by an arbitrary command execution  attack,1
adobe digital editions 4.5.11.187646 (and earlier) are affected by an arbitrary file write  attack,1
in all versions of gitlab ce/ee since version 8.15,1
in all versions of gitlab ce/ee since version 14.1,1
in all versions of gitlab ce/ee,1
there exists a content spoofing  attack,1
a stored reflected cross-site scripting  attack,1
in all versions of gitlab ee since version 14.1,1
in all versions of gitlab ce/ee since version 8.0,1
an uncontrolled resource consumption  attack,1
there is an uninitialized aod driver structure in smartphones.successful exploitation of this  attack,1
changlian blocklist has a business logic errors  attack,1
hwpcassistant has a improper input validation  attack,1
password vault has a external control of system or configuration setting  attack,1
myhuawei-app has a exposure of sensitive information to an unauthorized actor  attack,1
there is a null pointer dereference in smartphones.successful exploitation of this  attack,1
there is an out-of-bounds read in smartphones.successful exploitation of this  attack,1
hhee system has a code injection  attack,1
telephony application has a exposure of sensitive information to an unauthorized actor  attack,1
chang lian application has a  attack,1
phone manager application has a improper privilege management  attack,1
the hwnearbymain module has a data processing errors  attack,2
huawei idap module has a out-of-bounds read  attack,1
the hwnearbymain module has a improper validation of array index  attack,1
the hwnearbymain module has a exposure of sensitive information to an unauthorized actor  attack,1
the screen lock module has a stack-based buffer overflow  attack,1
there is an improper security permission configuration  attack,1
there is an integer overflow  attack,1
there is an arbitrary address access  attack,1
the caaskit module has a path traversal  attack,1
the cellular module has a  attack,1
the distributed data service component has a  attack,1
the fingerprint module has a security risk of brute force cracking. successful exploitation of this  attack,1
the bone voice id ta has a heap overflow  attack,1
there is an uncontrolled resource consumption  attack,1
improper permission control  attack,2
the bone voice id trusted application (ta) has a heap overflow  attack,1
the hw_keymaster module lacks the validity check of the key format. successful exploitation of this  attack,1
the eid module has a null pointer reference  attack,1
out-of-bounds heap read  attack,1
there is an out-of-bounds array read  attack,1
the eid module has an out-of-bounds memory write  attack,2
the weaver module has a  attack,1
implementation of the wlan module interfaces has the information disclosure  attack,2
the eid module has a  attack,1
the bone voice id ta has a  attack,2
the my huawei app has a defect in the design. successful exploitation of this  attack,1
there is an information exposure  attack,1
the video framework has the memory overwriting  attack,1
the bone voice id ta has a memory overwrite  attack,1
there is a double free  attack,1
there is a release of invalid pointer  attack,1
the laser command injection  attack,1
there is an incorrect buffer size calculation  attack,2
there is an integer underflow  attack,1
there is a man-in-the-middle attack  attack,1
there is a heap-based and stack-based buffer overflow  attack,1
the communication module has a service logic error  attack,1
emtec zoc before 8.02.2 allows \e201~ pastes,1
rapid7 insight agent,1
versions prior to 3.1.3,1
suffer from an improper access control  attack,1
an rf replay attack  attack,1
the appcheck research team identified a server-side request forgery (ssrf)  attack,1
phpfusion 9.03.110 is affected by an arbitrary file upload  attack,1
htmly v2.8.1 was discovered to contain an arbitrary file deletion  attack,1
weak password requirements  attack,1
missing handler  attack,1
hitachi energy linkone product,1
has a  attack,1
configuration  attack,1
openemr 6.0.0 has a pnotes_print.php?noteid= insecure direct object reference  attack,1
an oscommand injection  attack,1
an incorrect default permission  attack,4
server side request forgery (ssrf)  attack,1
a null pointer deference  attack,1
zangband zangband-data 2.7.5 is affected by an integer underflow  attack,1
an issue was discovered in opmantek open-audit after 3.5.0. without authentication,1
thinkcmf v5.1.7 has an unauthorized  attack,1
textpattern cms v4.8.7 and older  attack,1
eyesofnetwork before 07-07-2021 has a remote code execution  attack,1
os4ed opensis community 8.0 is vulnerable to a local file inclusion  attack,1
